[
  {
    "slug": "local-ai-agent-macbook",
    "title": "How I Built a Local AI Agent on My MacBook",
    "summary": "Draft skeleton for documenting a local model, an agent harness, and local tools.",
    "category": "Build Log",
    "tags": ["Local AI", "AI Agent", "Ollama", "Qwen"],
    "status": "draft",
    "published_at": null,
    "reading_time": null,
    "path": "articles/drafts/local-ai-agent-macbook.html",
    "cover": null,
    "related_knowledge": ["token.html", "context-window.html", "kv-cache.html", "inference.html", "quantization.html", "ollama.html"],
    "related_projects": ["portfolio-home.html#flagship", "portfolio-home.html#projects"],
    "need_diagrams": true,
    "need_comparison_table": false
  },
  {
    "slug": "local-vs-cloud-api-models",
    "title": "Local Models vs Cloud-Hosted Models vs Direct API Models",
    "summary": "A beginner-friendly comparison of deployment location, access boundaries, and the separate open-weight versus proprietary dimension.",
    "category": "AI Systems",
    "tags": ["Local LLM", "Cloud AI", "AWS", "API", "Open-Weight Models", "Claude", "Ollama"],
    "status": "published",
    "published_at": "2026-09-11",
    "reading_time": null,
    "path": "articles/drafts/local-vs-cloud-api-models.html",
    "cover": "articles/assets/diagrams/local-cloud-api-models.svg",
    "related_knowledge": ["llm.html", "inference.html", "api.html", "local-vs-cloud.html", "open-closed-local-models.html", "ai-agent.html", "ollama.html", "development-cloud-platforms.html"],
    "related_projects": ["portfolio-home.html#flagship"],
    "need_diagrams": true,
    "need_comparison_table": true
  },
  {
    "slug": "local-llm-vs-claude",
    "title": "Local LLM vs Claude: What Is Actually Different?",
    "summary": "Coming Soon — a comparison outline for local and hosted model workflows.",
    "category": "Comparison",
    "tags": ["Local LLM", "Claude", "Privacy", "Inference"],
    "status": "draft",
    "published_at": null,
    "reading_time": null,
    "path": null,
    "cover": null,
    "related_knowledge": ["llm.html", "inference.html", "latency.html", "context-window.html"],
    "related_projects": ["portfolio-home.html#projects"],
    "need_diagrams": true,
    "need_comparison_table": true
  },
  {
    "slug": "codex-claude-code-local-agents",
    "title": "Codex vs Claude Code vs Local Coding Agents",
    "summary": "Coming Soon — a practical comparison of coding-agent shapes, boundaries, and trade-offs.",
    "category": "Coding Agents",
    "tags": ["Codex", "Claude Code", "Coding Agents", "Tool Use"],
    "status": "draft",
    "published_at": null,
    "reading_time": null,
    "path": null,
    "cover": null,
    "related_knowledge": ["agent-harness.html", "tool-calling.html", "agents-tools-mcp.html"],
    "related_projects": ["portfolio-home.html#flagship"],
    "need_diagrams": true,
    "need_comparison_table": true
  },
  {
    "slug": "local-llm-context-window",
    "title": "Why My Local LLM Kept Running Out of Context",
    "summary": "Coming Soon — a diagnosis-focused article about context pressure in an agent workflow.",
    "category": "Experiments",
    "tags": ["Context Window", "KV Cache", "Local AI", "Debugging"],
    "status": "draft",
    "published_at": null,
    "reading_time": null,
    "path": null,
    "cover": null,
    "related_knowledge": ["context-window.html", "kv-cache.html", "token.html", "runtime-constraints.html"],
    "related_projects": ["portfolio-home.html#flagship"],
    "need_diagrams": true,
    "need_comparison_table": false
  },
  {
    "slug": "agent-tool-use",
    "title": "What Actually Happens When an AI Agent Uses a Tool?",
    "summary": "Coming Soon — a concept explanation of the request, tool, result, and control loop.",
    "category": "AI Agents",
    "tags": ["AI Agent", "Tool Use", "MCP", "Runtime"],
    "status": "draft",
    "published_at": null,
    "reading_time": null,
    "path": null,
    "cover": null,
    "related_knowledge": ["tool-calling.html", "agent-loop.html", "agent-harness.html", "mcp.html"],
    "related_projects": ["portfolio-home.html#projects"],
    "need_diagrams": true,
    "need_comparison_table": false
  },
  {
    "slug": "qwen-ollama-coding-agent-stack",
    "title": "My Local AI Stack: Qwen + Ollama + Coding Agent",
    "summary": "Coming Soon — a stack-level walkthrough of the local components and their connections.",
    "category": "AI Infrastructure",
    "tags": ["Qwen", "Ollama", "Local AI", "AI Infrastructure"],
    "status": "draft",
    "published_at": null,
    "reading_time": null,
    "path": null,
    "cover": null,
    "related_knowledge": ["ollama.html", "model-serving-local-ai.html", "llm.html", "runtime.html"],
    "related_projects": ["portfolio-home.html#flagship"],
    "need_diagrams": true,
    "need_comparison_table": false
  },
  {
    "slug": "multi-agent-knowledge-workbench",
    "title": "How I Designed a Multi-Agent Knowledge Workbench",
    "summary": "Coming Soon — an architecture outline for planning, workers, QA, retry, resume, and quota handling.",
    "category": "Architecture",
    "tags": ["Multi-Agent Systems", "Workflow", "QA", "Architecture"],
    "status": "draft",
    "published_at": null,
    "reading_time": null,
    "path": null,
    "cover": null,
    "related_knowledge": ["multi-agent-systems.html", "workflow-automation.html", "agent-frameworks.html", "evaluation.html"],
    "related_projects": ["portfolio-home.html#projects"],
    "need_diagrams": true,
    "need_comparison_table": false
  },
  {
    "slug": "27b-model-24gb-macbook",
    "title": "What I Learned Running a 27B Model on a 24GB MacBook",
    "summary": "Coming Soon — an experiment outline for memory, quantization, speed, context, and failure modes.",
    "category": "Experiments",
    "tags": ["27B Model", "MacBook", "Quantization", "Performance"],
    "status": "draft",
    "published_at": null,
    "reading_time": null,
    "path": null,
    "cover": null,
    "related_knowledge": ["quantization.html", "gpu-vram-unified-memory.html", "tokens-per-second.html", "runtime-constraints.html"],
    "related_projects": ["portfolio-home.html#flagship"],
    "need_diagrams": true,
    "need_comparison_table": true
  }
]
